{"speaker_info": "ID  AGE  GENDER  ACCENTS  REGION COMMENTS \np225  23  F    English    Southern  England\np226  22  M    English    Surrey\np227  38  M    English    Cumbria\np228  22  F    English    Southern  England\np229  23  F    English    Southern  England\np230  22  F    English    Stockton-on-tees\np231  23  F    English    Southern  England\np232  23  M    English    Southern  England\np233  23  F    English    Staffordshire\np234  22  F    Scottish  West  Dumfries\np236  23  F    English    Manchester\np237  22  M    Scottish  Fife\np238  22  F    NorthernIrish  Belfast\np239  22  F    English    SW  England\np240  21  F    English    Southern  England\np241  21  M    Scottish  Perth\np243  22  M    English    London\np244  22  F    English    Manchester\np245  25  M    Irish  Dublin\np246  22  M    Scottish  Selkirk\np247  22  M    Scottish  Argyll\np248  23  F    Indian  \np249  22  F    Scottish  Aberdeen\np250  22  F    English    SE  England\np251  26  M    Indian  \np252  22  M    Scottish  Edinburgh\np253  22  F    Welsh  Cardiff\np254  21  M    English    Surrey\np255  19  M    Scottish  Galloway\np256  24  M    English    Birmingham\np257  24  F    English    Southern  England\np258  22  M    English    Southern  England\np259  23  M    English    Nottingham\np260  21  M    Scottish  Orkney\np261  26  F    NorthernIrish  Belfast\np262  23  F    Scottish  Edinburgh\np263  22  M    Scottish  Aberdeen\np264  23  F    Scottish  West  Lothian\np265  23  F    Scottish  Ross\np266  22  F    Irish  Athlone\np267  23  F    English    Yorkshire\np268  23  F    English    Southern  England\np269  20  F    English    Newcastle\np270  21  M    English    Yorkshire\np271  19  M    Scottish  Fife\np272  23  M    Scottish  Edinburgh\np273  23  M    English    Suffolk\np274  22  M    English    Essex\np275  23  M    Scottish  Midlothian\np276  24  F    English    Oxford\np277  23  F    English    NE  England\np278  22  M    English    Cheshire\np279  23  M    English    Leicester\np280  25  F    Unknown  France (mic2 files unavailable)  \np281  29  M    Scottish  Edinburgh\np282  23  F    English    Newcastle\np283  24  F    Irish  Cork\np284  20  M    Scottish  Fife\np285  21  M    Scottish  Edinburgh\np286  23  M    English    Newcastle\np287  23  M    English    York\np288  22  F    Irish  Dublin\np292  23  M    NorthernIrish  Belfast\np293  22  F    NorthernIrish  Belfast\np294  33  F    American  San  Francisco\np295  23  F    Irish  Dublin\np297  20  F    American  New  York\np298  19  M    Irish  Tipperary\np299  25  F    American  California\np300  23  F    American  California\np301  23  F    American  North  Carolina\np302  20  M    Canadian  Montreal\np303  24  F    Canadian  Toronto\np304  22  M    NorthernIrish  Belfast\np305  19  F    American  Philadelphia\np306  21  F    American  New  York\np307  23  F    Canadian  Ontario\np308  18  F    American  Alabama\np310  21  F    American  Tennessee\np311  21  M    American  Iowa\np312  19  F    Canadian  Hamilton\np313  24  F    Irish  County  Down\np314  26  F    SouthAfrican  Cape  Town\np315  18  M    American  New  England  (Text and mic2 files unavailable) \np316  20  M    Canadian  Alberta\np317  23  F    Canadian  Hamilton\np318  32  F    American  Napa\np323  19  F    SouthAfrican  Pretoria\np326  26  M    Australian  English  Sydney\np329  23  F    American  \np330  26  F    American  \np333  19  F    American  Indiana\np334  18  M    American  Chicago\np335  25  F    NewZealand  English    \np336  18  F    SouthAfrican  Johannesburg\np339  21  F    American  Pennsylvania\np340  18  F    Irish  Dublin\np341  26  F    American  Ohio\np343  27  F    Canadian  Alberta\np345  22  M    American  Florida\np347  26  M    SouthAfrican  Johannesburg\np351  21  F    NorthernIrish  Derry\np360  19  M    American  New  Jersey\np361  19  F    American  New  Jersey\np362  29  F    American  \np363  22  M    Canadian  Toronto\np364  23  M    Irish  Donegal\np374  28  M    Australian  English  \np376  22  M    Indian\ns5    22  F    British (new speaker, more data would be released for training a speaker-dependent model) \n", "speaker_to_gender": {"p225": "F", "p226": "M", "p227": "M", "p228": "F", "p229": "F", "p230": "F", "p231": "F", "p232": "M", "p233": "F", "p234": "F", "p236": "F", "p237": "M", "p238": "F", "p239": "F", "p240": "F", "p241": "M", "p243": "M", "p244": "F", "p245": "M", "p246": "M", "p247": "M", "p248": "F", "p249": "F", "p250": "F", "p251": "M", "p252": "M", "p253": "F", "p254": "M", "p255": "M", "p256": "M", "p257": "F", "p258": "M", "p259": "M", "p260": "M", "p261": "F", "p262": "F", "p263": "M", "p264": "F", "p265": "F", "p266": "F", "p267": "F", "p268": "F", "p269": "F", "p270": "M", "p271": "M", "p272": "M", "p273": "M", "p274": "M", "p275": "M", "p276": "F", "p277": "F", "p278": "M", "p279": "M", "p280": "F", "p281": "M", "p282": "F", "p283": "F", "p284": "M", "p285": "M", "p286": "M", "p287": "M", "p288": "F", "p292": "M", "p293": "F", "p294": "F", "p295": "F", "p297": "F", "p298": "M", "p299": "F", "p300": "F", "p301": "F", "p302": "M", "p303": "F", "p304": "M", "p305": "F", "p306": "F", "p307": "F", "p308": "F", "p310": "F", "p311": "M", "p312": "F", "p313": "F", "p314": "F", "p315": "M", "p316": "M", "p317": "F", "p318": "F", "p323": "F", "p326": "M", "p329": "F", "p330": "F", "p333": "F", "p334": "M", "p335": "F", "p336": "F", "p339": "F", "p340": "F", "p341": "F", "p343": "F", "p345": "M", "p347": "M", "p351": "F", "p360": "M", "p361": "F", "p362": "F", "p363": "M", "p364": "M", "p374": "M", "p376": "M", "s5": "F"}, "speaker_to_accent": {"p225": "English", "p226": "English", "p227": "English", "p228": "English", "p229": "English", "p230": "English", "p231": "English", "p232": "English", "p233": "English", "p234": "Scottish", "p236": "English", "p237": "Scottish", "p238": "NorthernIrish", "p239": "English", "p240": "English", "p241": "Scottish", "p243": "English", "p244": "English", "p245": "Irish", "p246": "Scottish", "p247": "Scottish", "p248": "Indian", "p249": "Scottish", "p250": "English", "p251": "Indian", "p252": "Scottish", "p253": "Welsh", "p254": "English", "p255": "Scottish", "p256": "English", "p257": "English", "p258": "English", "p259": "English", "p260": "Scottish", "p261": "NorthernIrish", "p262": "Scottish", "p263": "Scottish", "p264": "Scottish", "p265": "Scottish", "p266": "Irish", "p267": "English", "p268": "English", "p269": "English", "p270": "English", "p271": "Scottish", "p272": "Scottish", "p273": "English", "p274": "English", "p275": "Scottish", "p276": "English", "p277": "English", "p278": "English", "p279": "English", "p280": "Unknown", "p281": "Scottish", "p282": "English", "p283": "Irish", "p284": "Scottish", "p285": "Scottish", "p286": "English", "p287": "English", "p288": "Irish", "p292": "NorthernIrish", "p293": "NorthernIrish", "p294": "American", "p295": "Irish", "p297": "American", "p298": "Irish", "p299": "American", "p300": "American", "p301": "American", "p302": "Canadian", "p303": "Canadian", "p304": "NorthernIrish", "p305": "American", "p306": "American", "p307": "Canadian", "p308": "American", "p310": "American", "p311": "American", "p312": "Canadian", "p313": "Irish", "p314": "SouthAfrican", "p315": "American", "p316": "Canadian", "p317": "Canadian", "p318": "American", "p323": "SouthAfrican", "p326": "Australian", "p329": "American", "p330": "American", "p333": "American", "p334": "American", "p335": "NewZealand", "p336": "SouthAfrican", "p339": "American", "p340": "Irish", "p341": "American", "p343": "Canadian", "p345": "American", "p347": "SouthAfrican", "p351": "NorthernIrish", "p360": "American", "p361": "American", "p362": "American", "p363": "Canadian", "p364": "Irish", "p374": "Australian", "p376": "Indian", "s5": "British"}}